title,url,time_published,summary,source,overall_sentiment_score,overall_sentiment_label,date
UBS reiterates Packaging Corp. of America stock buy on guidance miss risk,https://ca.investing.com/news/stock-market-news/ubs-reiterates-packaging-corp-of-america-stock-buy-on-guidance-miss-risk-93CH-4686642,2026-06-11 14:38:29,"UBS has reiterated a Buy rating and a $248.00 price target for Packaging Corp. of America (NYSE:PKG), despite the company indicating a potential miss on its second-quarter earnings guidance. The company cited higher freight and recycled fiber costs, as well as lower outside sales and exports, as reasons for the expected shortfall. However, UBS maintains its positive outlook alongside other analysts who have also reiterated Buy ratings and increased price targets due to the company's pricing power, integration synergies, and strong demand outlook.",Investing.com Canada,0.049732,Neutral,2026-06-11
Oppenheimer raises Tesla stock price target on storage demand,https://www.investing.com/news/analyst-ratings/oppenheimer-raises-tesla-stock-price-target-on-storage-demand-93CH-4737494,2026-06-11 13:25:40,"Oppenheimer has increased its price target for Tesla (NASDAQ:TSLA) due to anticipated higher demand for stationary storage and increased vehicle sales. The firm attributes this growth to Tesla's product evolution, cost reductions, and the supportive effect of elevated oil prices on global EV demand. Additionally, Oppenheimer noted that speculation regarding a potential merger with SPCX may provide some support for Tesla shares, recognizing CEO Elon Musk's strategy for diversified capital access with two public currencies.",Investing.com,0.203912,Somewhat-Bullish,2026-06-11
"Is the 2026 Toyota bZ Woodland a Good Crossover EV? 5 Pros, 2 Cons",https://www.cars.com/articles/is-the-2026-toyota-bz-woodland-a-good-crossover-ev-5-pros-2-cons-525768/,2026-06-11 11:39:09,"The 2026 Toyota bZ Woodland is an electric crossover aimed at active-lifestyle buyers, offering increased space, all-wheel drive, and 375 horsepower. It shares many characteristics with the Subaru Trailseeker but adds 6 inches in length for more cargo and passenger room. While it boasts quick acceleration and decent range, its interior design and higher price point compared to the Trailseeker are noted as potential downsides.",Cars.com,0.037104,Neutral,2026-06-11
"General Motors pivots battery strategy, puts LMR ahead of widely used LFP - report (GM:NYSE)",https://seekingalpha.com/news/4602466-general-motors-pivots-battery-strategy-puts-lmr-ahead-of-widely-used-lfp---report,2026-06-11 09:27:02,"General Motors is reportedly shifting its electric vehicle battery strategy away from lithium iron phosphate (LFP) towards lithium manganese-rich (LMR) technology. This move suggests a significant change in GM's approach to EV chemistry. The report, citing Reuters, indicates a pivot in the company's long-term battery plans.",Seeking Alpha,0.138295,Neutral,2026-06-11
Musk to discuss Terafab chip plant plans at ASML event (ASML:NASDAQ),https://seekingalpha.com/news/4602459-musk-to-discuss-terafab-chip-plant-plans-at-asml-event,2026-06-11 08:10:40,"Elon Musk is scheduled to virtually attend ASML's annual technology conference on Thursday. He is expected to discuss Terafab, his semiconductor manufacturing venture. This initiative aims to produce chips for Tesla and SpaceX.",Seeking Alpha,0.172115,Somewhat-Bullish,2026-06-11
"PepsiCo, Inc. $PEP Shares Acquired by Capital Wealth Planning LLC",https://www.marketbeat.com/instant-alerts/filing-pepsico-inc-pep-shares-acquired-by-capital-wealth-planning-llc-2026-06-11/,2026-06-11 07:08:26,"Capital Wealth Planning LLC significantly increased its stake in PepsiCo, Inc. (NASDAQ:PEP) during the fourth quarter, buying an additional 7,739 shares to hold a total of 20,703 shares valued at approximately $2.97 million. Institutional investors and hedge funds own 73.07% of PepsiCo's stock. The company recently reported strong quarterly results, increased its dividend to $1.48 per share, and is rated a consensus ""Hold"" by analysts with an average price target of $169.58.",MarketBeat,0.260102,Somewhat-Bullish,2026-06-11
Cathie Wood buys $4.3 million of tumbling tech stock,https://sg.finance.yahoo.com/news/cathie-wood-buys-4-3-021604824.html,2026-06-11 02:16:00,"Cathie Wood's Ark Investment Management recently purchased $4.3 million worth of DoorDash (DASH) shares after the stock experienced a significant decline. This purchase aligns with Wood's strategy of buying into high-tech companies following selloffs, despite her flagship Ark Innovation ETF (ARKK) currently underperforming the S&P 500 this year and showing negative long-term annualized returns. Wood also anticipates a Federal Reserve rate cut, believing new chair Kevin Warsh will reduce rates due to increased productivity from technology and moderating inflation.",Yahoo Finance Singapore,0.041694,Neutral,2026-06-11
Cathie Wood Asks Elon Musk How Tesla Handles 'Parking And Traffic Violations' After The Robotaxi She Rode Gets $75 Ticket,https://finance.yahoo.com/markets/stocks/articles/cathie-wood-asks-elon-musk-013046976.html,2026-06-11 01:38:27,"Cathie Wood, CEO of ARK Invest, posed a question to Elon Musk regarding how Tesla plans to manage parking and traffic violations for its Robotaxi fleet after a driverless Tesla she rode in Austin received a $75 parking ticket. Wood indicated that this new operating expense would be added to ARK's valuation model for Tesla, highlighting a real-world cost that autonomous vehicle operators must address. Despite the ticket, she praised the smooth performance of Tesla's autonomous service compared to other robotaxi experiences.",Yahoo Finance,-0.048733,Neutral,2026-06-11
Why SpaceX (SPCX) Could Trade Like Tesla On Steroids,https://uk.finance.yahoo.com/news/why-spacex-spcx-could-trade-005028221.html,2026-06-11 00:49:37,"The article discusses how SpaceX (SPCX), set to trade on Nasdaq, could exhibit similar high volatility and narrative-driven trading patterns as Tesla (TSLA). It highlights factors like scarcity, a devoted retail base, a visionary founder (Elon Musk), and ambitious future plans (Starship, Mars, Starlink) contributing to an expected $1.75 trillion valuation, making it susceptible to significant price swings. The author also cautions investors about leveraged ETFs like SPCU, which aim to double SpaceX's daily moves, urging careful consideration of their inherent risks.",Yahoo Finance UK,0.34779,Somewhat-Bullish,2026-06-11
"Sylebra Capital LLC, an Impinj director, sells $8.3 million in stock",https://www.investing.com/news/insider-trading-news/sylebra-capital-llc-an-impinj-director-sells-83-million-in-stock-93CH-4736286,2026-06-10 22:41:17,"Sylebra Capital LLC, a director of Impinj Inc. (NASDAQ:PI), has sold approximately $8.3 million worth of common stock over two days, disposing of 64,633 shares at prices ranging from $125.9651 to $130.0685. These transactions occurred amidst a 9.2% weekly decline and a 28% year-to-date drop in Impinj's stock, which InvestingPro assesses as currently overvalued. Despite the stock sale, Impinj recently reported strong first-quarter 2026 earnings, exceeding analyst expectations for both EPS and revenue, and UBS raised its price target for the company to $175, citing improved inventory management and strengthening demand drivers.",Investing.com,-0.380519,Bearish,2026-06-10
Sociedad Química y Minera de Chile (SQM) Is Down 5.5% After Strong Q1 Beat And Higher Lithium Guidance,https://simplywall.st/stocks/us/materials/nyse-sqm/sociedad-quimica-y-minera-de-chile/news/sociedad-qumica-y-minera-de-chile-sqm-is-down-55-after-stron,2026-06-10 22:39:49,"Sociedad Química y Minera de Chile (SQM) reported strong Q1 2026 results with increased sales and net income, alongside higher lithium sales volumes and raised full-year guidance. Despite this positive performance, the stock is down 5.5%, highlighting investor concerns about lithium price volatility and potential oversupply. The company's investment narrative projects significant revenue and earnings growth by 2028, leading to a fair value estimate in line with its current price.",Simply Wall Street,0.100301,Neutral,2026-06-10
Tesla’s Robotaxi Falls Short With Long Waits and Stalled Rides,https://www.bloomberg.com/news/features/2026-06-10/tesla-robotaxi-fleet-totals-just-59-vehicles-despite-musk-promises,2026-06-10 22:15:00,"Despite Elon Musk's ambitious promises to have Tesla robotaxis cover half the US population by late 2025, the company's fleet remains limited to just 59 vehicles operating in three Texas cities. Early user experiences are plagued by long waits and stalled rides, indicating the service is far from the broad rollout Musk initially envisioned.",Bloomberg.com,-0.39202,Bearish,2026-06-10
Arteris president and CEO Charles Janac sells $2.44 million in stock,https://www.investing.com/news/insider-trading-news/arteris-president-and-ceo-charles-janac-sells-244-million-in-stock-93CH-4736140,2026-06-10 20:09:46,"Charles Janac, President and CEO of Arteris Inc., sold 70,000 shares of common stock totaling approximately $2.44 million on June 8, 2026. These sales, executed via a pre-arranged 10b5-1 trading plan, occurred after a significant stock appreciation but also a recent decline, with the stock appearing overvalued according to InvestingPro. Arteris recently exceeded Q1 2026 financial expectations and received a raised price target from TD Cowen due to strong AI growth and automotive performance.",Investing.com,0.087265,Neutral,2026-06-10
Tesla robotaxis stall as Musk’s self-driving hype hits real-world traffic,https://www.latimes.com/business/story/2026-06-10/tesla-robotaxis-stall-as-musks-self-driving-hype-hits-real-world-traffic,2026-06-10 17:42:27,"Tesla's highly anticipated robotaxi service, launched by Elon Musk in July 2025 with big promises of rapid expansion, has significantly underperformed expectations. Almost a year later, the fleet numbers only 59 vehicles operating in three Texas cities, a far cry from the projected ""half the population of the U.S."" and ""500 or more"" in Austin alone. The article highlights user frustrations with long wait times, limited availability, and inconsistent drop-off locations, suggesting the technology isn't yet ready for widespread deployment despite Musk's ambitious claims.",Los Angeles Times,0.040921,Neutral,2026-06-10
East West Bancorp stock hits all-time high at 130.19 USD,https://www.investing.com/news/company-news/east-west-bancorp-stock-hits-alltime-high-at-13019-usd-93CH-4735525,2026-06-10 15:09:35,"East West Bancorp Inc. (EWBC) stock reached an all-time high of $130.19, reflecting a 38.51% increase over the past year. Despite trading just below its 52-week high, InvestingPro data suggests the company remains undervalued. The strong performance follows positive first-quarter 2026 financial results, which surpassed earnings and revenue expectations, leading to several analysts raising their price targets and maintaining ""Buy"" or ""Overweight"" ratings.",Investing.com,0.18738,Somewhat-Bullish,2026-06-10
"Musk’s jet travels highlight Texas, global business moves. Here's where he went.",https://www.statesman.com/business/article/elon-musk-jet-travel-2026-texas-spacex-tesla-xai-22203608.php,2026-06-10 14:34:45,"Elon Musk's early 2026 activities involved significant travel related to his companies, Tesla and SpaceX, and other ventures. His private jet logged",Austin American-Statesman,0.069601,Neutral,2026-06-10
"BYD outsold Ford, and now it thinks it can catch Toyota as the world’s No. 1 automaker",https://electrek.co/2026/06/10/byd-outsold-ford-thinks-it-can-catch-toyota-for-no-1/,2026-06-10 14:09:00,"BYD, already the world’s largest EV maker, is confident it will become the leading global automaker within five years, aiming to surpass Toyota. Having sold over 4.6 million new energy vehicles last year and exceeding Ford in sales, BYD is expanding its overseas presence and deploying new battery and charging technologies. While other traditional automakers delay EV projects, BYD builds most components in-house and plans a significant rollout of its Flash Charging stations across Europe.",Electrek,0.094964,Neutral,2026-06-10
"Tesla Has 'Effectively' Achieved Level 4 Autonomy, Says Piper Sandler Analyst – How A Trip To Minneapolis Strengthened His Conviction",https://www.tradingview.com/news/stocktwits:5f9bbb5ac094b:0-tesla-has-effectively-achieved-level-4-autonomy-says-piper-sandler-analyst-how-a-trip-to-minneapolis-strengthened-his-conviction/,2026-06-10 13:38:32,"Piper Sandler analyst Alexander Potter believes Tesla has ""effectively"" achieved Level 4 autonomy, citing the company's FSD subscriptions, robotaxi expansion, and plans for the Cybercab without a steering wheel. This conviction was reinforced by a trip where his Tesla drove him from Montana to Minneapolis. Tesla is also expanding FSD Supervised in Europe, while JPMorgan highlights Tesla's ""unmatched"" advantage in manufacturing and AI.",TradingView,0.045567,Neutral,2026-06-10
Centene and UFP Industries have been highlighted as Zacks Bull and Bear of the Day,https://www.tradingview.com/news/zacks:047307d73094b:0-centene-and-ufp-industries-have-been-highlighted-as-zacks-bull-and-bear-of-the-day/,2026-06-10 12:10:28,"Zacks Equity Research has named Centene Corporation (CNC) as its ""Bull of the Day"" due to its impressive turnaround, strong financial performance, and positive earnings outlook in the healthcare sector. Conversely, UFP Industries (UFPI) has been designated as the ""Bear of the Day"" due to significant vulnerabilities, broad-based demand weakness, and ongoing margin compression stemming from its ties to the struggling housing and construction markets. The article also includes a discussion on SpaceX's anticipated IPO, comparing it to Tesla's market entry while highlighting the potential risks associated with its high valuation.",TradingView,0.075549,Neutral,2026-06-10
From $4 To $500? Eric Jackson's Bold Thesis Pitches Opendoor As Real Estate's Tesla Moment,https://www.benzinga.com/markets/equities/26/06/53111178/from-4-to-500-eric-jacksons-bold-thesis-pitches-opendoor-as-real-estates-tesla-moment,2026-06-10 12:09:39,"Eric Jackson, founder of EMJ Capital, suggests that Opendoor (NASDAQ: OPEN) could achieve a ""$500 stock"" valuation within five to seven years, representing an 11,420.73% upside from its current trading price. This bold prediction is based on his belief that Opendoor is uniquely positioned to revolutionize the housing market through the tokenization of real estate, separating land ownership from physical structures to lower homeownership costs and attract institutional capital. Jackson posits that Opendoor, unlike its competitors, possesses critical advantages such as asset-class control, pricing-data depth, vertical integration, and leadership with ""crypto-native architecture experience,"" making it a generational investment opportunity similar to early Tesla and Shopify.",Benzinga,0.345366,Somewhat-Bullish,2026-06-10
Centene and UFP Industries have been highlighted as Zacks Bull and Bear of the Day,https://finance.yahoo.com/sectors/healthcare/articles/centene-ufp-industries-highlighted-zacks-123800991.html,2026-06-10 12:09:30,"Zacks Equity Research has named Centene Corporation (CNC) as its Bull of the Day due to its impressive turnaround, recovering margins, and strong earnings estimates, positioning it for continued outperformance in the healthcare sector. Conversely, UFP Industries (UFPI) has been designated the Bear of the Day, grappling with broad demand weakness, falling volumes, and margin compression across all segments, driven by challenges in the housing and construction markets. The article also provides a speculative discussion on SpaceX's upcoming IPO, comparing its potential to Tesla's past success.",Yahoo Finance,0.118223,Neutral,2026-06-10
Tesla struggles with long robotaxi wait times in Austin with less than 60 vehicles in operation (TSLA:NASDAQ),https://seekingalpha.com/news/4602125-tesla-struggles-with-long-robotaxi-wait-times-in-austin-with-less-than-60-vehicles-in,2026-06-10 11:55:48,"Tesla is reportedly experiencing significant challenges with its robotaxi service in Austin, with customers facing long wait times and booking difficulties. Bloomberg's test rides revealed waits of up to 30 minutes, indicating a limited operational capacity with fewer than 60 vehicles. This suggests that Tesla's robotaxi deployment is facing scalability issues in its early stages.",Seeking Alpha,-0.418868,Bearish,2026-06-10
"Is the 2026 Subaru Uncharted a Good Crossover EV? 5 Pros, 2 Cons",https://www.cars.com/articles/is-the-2026-subaru-uncharted-a-good-crossover-ev-5-pros-2-cons-525606/,2026-06-10 11:09:49,"The 2026 Subaru Uncharted is a new crossover EV introduced by Subaru, boasting over 300 miles of range and a competitive starting price. It’s part of a joint venture with Toyota, sharing many characteristics with the Toyota C-HR but tuned with Subaru's outdoor persona. This review highlights five pros, including reasonable range, light off-roading capability, good tech, decent value, and cabin comfort, alongside two cons: the rapidly increasing price for AWD and its limited off-road capability compared to traditional Subarus.",Cars.com,0.064499,Neutral,2026-06-10
VinFast posts wider first-quarter loss as revenue and deliveries miss expectations (VFS),http://www.msn.com/en-us/money/companies/vinfast-posts-wider-first-quarter-loss-as-revenue-and-deliveries-miss-expectations-vfs/ar-AA25aKsA?ocid=finance-verthp-feeds&apiversion=v2&domshim=1&noservercache=1&noservertelemetry=1&batchservertelemetry=1&renderwebcomponents=1&wcseo=1,2026-06-10 10:39:09,"VinFast (VFS) reported a wider first-quarter loss, with revenue and electric vehicle deliveries falling short of expectations. The company recorded a net loss of $641 million, an increase from both the previous quarter and the same period last year. Despite a 26% year-over-year rise in revenue, it missed analyst estimates, as did its EV deliveries which totaled 9,689 units.",MSN,-0.154864,Somewhat-Bearish,2026-06-10
General Motors plots sodium-ion tech leapfrog into grid-scale energy storage market,https://www.energy-storage.news/general-motors-plots-sodium-ion-tech-leapfrog-into-grid-scale-energy-storage-market/,2026-06-10 10:22:45,"General Motors (GM) is entering the grid-scale energy storage market by partnering with sodium-ion battery startup Peak Energy and making a strategic investment in the company. GM will develop prototype sodium-ion cells for grid applications at its Michigan R&D facility, aiming for production this year. This move is part of GM's broader distributed energy strategy, which also includes LFP cell production for near-term demand, bidirectional vehicle-to-grid (V2G) applications, and second-life battery energy storage systems (BESS).",Energy-Storage.News,0.226144,Somewhat-Bullish,2026-06-10
Autonomous Trucking Stock Aurora Is Finally Hitting the Fast Lane,https://www.morningstar.com/stocks/autonomous-trucking-stock-aurora-is-finally-hitting-fast-lane,2026-06-10 10:09:47,"Aurora Innovation's stock is gaining momentum, with shares up over 60% this year, as the company expands its partnerships in the autonomous trucking sector. Morningstar analyst Seth Goldstein is optimistic about Aurora's future, predicting a significant ramp-up in autonomous long-haul trucking by the end of 2026 and potential for exponential growth over the next decade. Despite regulatory hurdles and initial stock struggles, Aurora is shifting to a more profitable ""driver as a service"" model and is positioned as a market leader, with Goldstein setting a fair value estimate of $12 per share.",Morningstar,0.270002,Somewhat-Bullish,2026-06-10
"Brand Asset Management Group Inc. Has $350,000 Holdings in Tesla, Inc. $TSLA",https://www.marketbeat.com/instant-alerts/filing-brand-asset-management-group-inc-has-350000-holdings-in-tesla-inc-tsla-2026-06-10/,2026-06-10 07:24:54,"Brand Asset Management Group Inc. significantly reduced its stake in Tesla (NASDAQ:TSLA) by 83.2% in the fourth quarter, now holding 778 shares valued at $350,000. This reduction comes amid other institutional investors adjusting their positions and recent insider selling, including transactions by Tesla's Director Kathleen Wilson-Thompson and CFO Vaibhav Taneja. Despite a 3% drop in share price, analysts maintain a ""Hold"" rating with an average target price of $404.37, driven by mixed sentiments regarding Tesla's valuation and future prospects in autonomy and energy.",MarketBeat,0.147571,Neutral,2026-06-10
"Elon Musk Praises Tesla's 'Awesome' AI Chip Team, Says AI6 May Set New Wafer Intelligence Record",https://www.benzinga.com/markets/tech/26/06/53107258/elon-musk-praises-tesla-awesome-ai-chip-team-ai6-wafer-intelligence-record,2026-06-10 06:08:46,"Elon Musk lauded Tesla's AI chip design team, stating that their AI6 chip could achieve a new record for usable intelligence from a wafer due to its focus on manufacturability. This strategy aims to maximize computing power from each production run by designing chips that are more resilient to defects. Tesla plans for the AI6 chip to double performance over its predecessor and intends to collaborate with Samsung and TSMC for its production, as part of a larger push towards reducing reliance on external foundries.",Benzinga,0.2449,Somewhat-Bullish,2026-06-10
"ETB: Good Income Fund, But High Tech Exposure Could Be A Risk",https://seekingalpha.com/article/4913587-etb-good-income-fund-but-high-tech-exposure-could-be-a-risk,2026-06-10 05:40:47,"The Eaton Vance Tax-Managed Buy-Write Income Fund (ETB) offers an 8.33% yield through an index call-writing strategy, providing income and mitigating downside risk. While it has underperformed the S&P 500 in recent bull markets, its strategy may be beneficial in volatile conditions. The fund's sector allocation, with lower tech and higher financials/energy exposure, provides diversification against sector-specific risks, and it currently trades at an 8.22% NAV discount.",Seeking Alpha,-0.08768,Neutral,2026-06-10
EHang Holdings Ltd. Sponsored ADR Class A Trade Ideas — TRADEGATE:3UIA,https://www.tradingview.com/symbols/TRADEGATE-3UIA/ideas/page-2/,2026-06-10 05:38:58,"This article compiles various trade ideas and analyses for EHang Holdings Ltd. (EH) from different traders on TradingView. Discussions range from technical analysis and price predictions to reactions to a short report by Wolfpack Research, which alleged fabricated revenues and empty facilities. Traders share long-term bullish outlooks, caution against volatility, and provide strategies for managing risk when trading EH stock.",TradingView,0.176744,Somewhat-Bullish,2026-06-10
TSLA Stock Hits 1-Month Low Amid SpaceX Merger Jitters — But Analyst Sees Tesla Holders Getting 66% Of Deal Within A Year,https://stocktwits.com/news-articles/markets/equity/tsla-spacex-merger-analyst-tesla-holders-deal-within-a-year/cZ06PtoR7Ry,2026-06-10 03:08:46,"Tesla (TSLA) stock hit a one-month low due to speculation about a potential merger with SpaceX. Despite market jitters, Morningstar predicts that Tesla shareholders could receive 66% of a combined entity, noting increasing collaboration between the two companies in AI and other areas. However, analysts also point out significant risks, including shareholder opposition and regulatory challenges from Tesla's China operations.",Stocktwits,-0.133238,Neutral,2026-06-10
"[Form 4] Tesla, Inc. Insider Trading Activity",https://www.stocktitan.net/sec-filings/TSLA/form-4-tesla-inc-insider-trading-activity-6d3f6c3a950d.html,2026-06-09 23:08:53,"Tesla's Chief Financial Officer, Vaibhav Taneja, engaged in insider trading activity, selling 2,605.5 shares of common stock valued at approximately $1.05 million. This sale was primarily to satisfy tax withholding obligations related to the vesting of restricted stock units. The Form 4 filing details the transactions and Taneja's remaining direct and indirect holdings in Tesla stock.",Stock Titan,-0.22015,Somewhat-Bearish,2026-06-09
REX TSLA Growth & Income ETF announces weekly distribution of $0.1970,https://www.msn.com/en-us/money/topstocks/rex-tsla-growth-income-etf-announces-weekly-distribution-of-0-1970/ar-AA25dlPY,2026-06-09 20:39:24,REX TSLA Growth & Income ETF has announced a weekly distribution of $0.1970 per share for its shareholders. This distribution will be paid on a specified future date to shareholders of record as of a particular cutoff date. The ex-dividend date is also provided.,MSN,0.099341,Neutral,2026-06-09
Avoiding Lag: Real-Time Signals in (TSLP) Movement,https://news.stocktradersdaily.com/news_release/1/Avoiding_Lag:_Real-Time_Signals_in_TSLP_Movement_060926081802_1781050682.html,2026-06-09 20:18:00,"This article provides a real-time signal analysis for Kurv Yield Premium Strategy Tesla ETF (TSLP), highlighting a weak near and mid-term sentiment that could challenge a positive long-term outlook. It details specific institutional trading strategies, including position, momentum breakout, and risk hedging, along with multi-timeframe signal analysis and support/resistance levels. The analysis aims to help investors optimize position sizing and minimize drawdown risk.",Stock Traders Daily,-0.087332,Neutral,2026-06-09
