title,url,time_published,summary,source,overall_sentiment_score,overall_sentiment_label,date
A Nissan Leaf by Another Name: Mitsubishi Unveils 2027 Eclipse Sportback EV,https://www.cars.com/articles/a-nissan-leaf-by-another-name-mitsubishi-unveils-2027-eclipse-sportback-ev-525754/,2026-06-09 19:40:22,"Mitsubishi has unveiled images of the 2027 Eclipse Sportback, an electric vehicle based on the redesigned 2026 Nissan Leaf. While technical details and pricing are not yet available, Mitsubishi confirmed cosmetic changes will differentiate it from the Leaf. The Eclipse Sportback is expected to go on sale by early fall 2026, marking Mitsubishi's return to the all-electric vehicle market since the i-MiEV was discontinued after the 2017 model year.",Cars.com,0.106167,Neutral,2026-06-09
Major auto parts maker open to assembling Chinese vehicles in Canada,https://www.detroitnews.com/story/business/autos/2026/06/09/major-auto-parts-supplier-magna-hopes-to-grow-with-chinese-automakers/90459549007/,2026-06-09 19:37:00,"Magna International, a major global automotive supplier headquartered in Canada, is open to assembling Chinese vehicles in Canada if the plans are long-term. CEO Swamy Kotagiri emphasized that Magna aims to grow with Chinese automakers expanding globally, leveraged by their existing production and systemic knowledge from nearly two decades of operation in China. This strategy follows Magna's recent contract to build two models for Chinese EV maker XPENG in Austria and aligns with growing ties between Canadian companies and Chinese automakers due to shifting trade dynamics.",The Detroit News,0.160315,Somewhat-Bullish,2026-06-09
What to know about upcoming SpaceX IPO,https://www.ally.com/stories/invest/what-to-know-ipos/,2026-06-09 19:10:04,"SpaceX is filing its S-1 prospectus to go public via an IPO, aiming to raise nearly $75 billion with a target valuation of $1.8 trillion. The article explains the IPO process, where private companies offer shares to public investors, and highlights the risks involved, such as demand uncertainty, price volatility, and historically mixed returns for newly public companies. Frank Newman, Portfolio Director at Ally Invest, advises investors to conduct thorough research and consider if an IPO fits their investment strategy and risk tolerance, also mentioning diversification strategies.",Ally,0.189803,Somewhat-Bullish,2026-06-09
Tesla Wins Denmark Green Light For FSD Expansion — But TSLA Stock Slips,https://stocktwits.com/news-articles/markets/equity/tesla-wins-denmark-green-light-for-fsd-expansion/cZ0Ukm1R7RS,2026-06-09 18:09:09,"Tesla has received approval from the Danish Road Traffic Authority for its Full Self-Driving (FSD) driver assistance software to be used on public roads in Denmark. This expansion follows similar approvals in other European nations like the Netherlands, Lithuania, and Estonia, though EU-wide approval is still pending. Despite this progress in FSD expansion, Tesla's stock (TSLA) slipped 4%, and retail sentiment remained bearish, amid distractions and delays related to other company ventures.",Stocktwits,-0.197328,Somewhat-Bearish,2026-06-09
"Tesla (TSLA) Rolls Out Unsupervised Robotaxis in Austin Metro Area, Reuters Reports",https://finance.yahoo.com/markets/stocks/articles/tesla-tsla-rolls-unsupervised-robotaxis-172433211.html,2026-06-09 17:24:38,"Tesla (NASDAQ: TSLA) is expanding its unsupervised robotaxi service throughout the Austin Metro area, a move reported by Reuters in early June. This initiative is central to Tesla's growth strategy, which has pivoted towards AI and robotics, aiming to accelerate its autonomous ride-hailing operations. Additionally, Estonia's transport authority recently cleared Tesla's FSD driver-assistance system for use on its roads, though it remains a Level 2 system requiring driver responsibility.",Yahoo Finance,0.439971,Bullish,2026-06-09
Yikes! Elon Musk's Robotaxi Fleet Is Smaller Than Pepsi's Doritos Truck Fleet,https://www.benzinga.com/markets/prediction-markets/26/06/53092439/yikes-elon-musks-robotaxi-fleet-is-smaller-than-pepsis-doritos-truck-fleet,2026-06-09 15:36:34,"Despite Elon Musk's emphasis on autonomy, PepsiCo has a larger fleet of fully driverless trucks operating on public roads than Tesla's unsupervised robotaxi service, according to a recent Wall Street Journal report. PepsiCo's 41 driverless trucks, used for hauling snacks and beverages, have logged zero accidents and high on-time rates, while Tesla's robotaxi fleet is significantly smaller and faces skepticism from prediction markets regarding its future deployment. Tesla's market capitalization relies heavily on its autonomy thesis, but meaningful robotaxi fleet expansion and FSD software release are delayed.",Benzinga,0.057987,Neutral,2026-06-09
Trump Media stock hits 52-week low at 3.8 USD,https://www.investing.com/news/company-news/trump-media-stock-hits-52week-low-at-38-usd-93CH-4733470,2026-06-09 15:09:05,"Trump Media & Technology Group’s equity warrants (DJTWW) have fallen to a 52-week low of $3.82, marking a significant 72% decline from their peak of $13.48. The company's stock has also seen a substantial 69.84% drop over the past year, with a 9.5% decrease in the last week alone, reflecting ongoing market pressures and negative investor sentiment.",Investing.com,-0.116198,Neutral,2026-06-09
"With The SpaceX IPO Imminent, Nvidia And Tesla Accelerate The Race For Physical AI",https://www.forbes.com/sites/drewbernstein/2026/06/09/with-the-spacex-ipo-imminent-nvidia-tesla-unitree-and-the-global-race-for-physical-ai/,2026-06-09 14:38:09,"Nvidia and Tesla are leading the race in physical AI, pursuing different strategies to dominate the sector as the SpaceX IPO approaches. Nvidia focuses on being an ""arms dealer"" by providing platform infrastructure, partnering with hardware manufacturers globally, including China's Unitree Robotics. In contrast, Tesla under Elon Musk aims for vertical integration, building the entire AI stack for its Optimus robot, leveraging its existing FSD technology. This competition highlights the distinct approaches of the U.S. and China in developing embodied intelligence, with implications for labor economics, supply chain control, and national security, especially if a Tesla-SpaceX merger occurs.",Forbes,0.268482,Somewhat-Bullish,2026-06-09
Solidion Strengthens Battery Moat with 7 New Patents,https://finance.yahoo.com/sectors/technology/articles/solidion-strengthens-battery-moat-7-142833032.html,2026-06-09 14:28:00,"Solidion Technology, Inc. announced it has been granted seven new U.S. patents for anode materials used in lithium batteries, bringing its total U.S. patents to 130. The company's anode technology aims to enhance AI data center uptime with higher energy density, lower costs, and domestically sourced materials. Solidion also raised $35 million through a stock sale to commercialize its Extreme-Climate Battery technology.",Yahoo Finance,0.49401,Bullish,2026-06-09
"McDonald’s Stock Could Be Bottoming, Creating a Contrarian Bet for Long-Term Investors",https://www.barchart.com/story/news/2380179/mcdonalds-stock-could-be-bottoming-creating-a-contrarian-bet-for-long-term-investors,2026-06-09 14:08:05,"McDonald's stock (MCD) appears to be establishing a technical floor around $275-$280 after a period of consolidation, despite a recent 10% decline. Technical indicators show signs of bottoming, with a bullish divergence in the percentage price oscillator. Analysts maintain a ""Moderate Buy"" rating, with an average price target of $333, suggesting a potential 20% upside for this defensive, low-beta stock.",Barchart.com,0.201469,Somewhat-Bullish,2026-06-09
"Scott Galloway Says Tesla, Nvidia, Broadcom Could Get Caught In The Crossfire Of The Space X IPO",https://www.benzinga.com/markets/prediction-markets/26/06/53087487/scott-galloway-says-tesla-nvidia-broadcom-could-get-caught-in-the-crossfire-of-the-space-x-ipo,2026-06-09 14:07:07,"NYU professor Scott Galloway warns that upcoming IPOs from companies like SpaceX, Anthropic, and OpenAI could create a significant ""supply flood"" in the equity market, potentially leading to an 80% collapse for one of these new market debuts. He suggests that investors reallocating funds to these new offerings might sell off existing holdings, impacting companies like Tesla, Nvidia, and Broadcom. While some analysts believe the market is large enough to absorb this, Galloway draws parallels to past tech booms and busts, indicating a potential correction.",Benzinga,-0.183115,Somewhat-Bearish,2026-06-09
2027 Rivian R2 First Drive: Time to Trade in Your Tesla,https://www.cars.com/articles/2027-rivian-r2-first-drive-time-to-trade-in-your-tesla-525485/,2026-06-09 13:39:09,"The 2027 Rivian R2 is presented as a highly compelling mid-size electric SUV that offers a blend of luxury, capability, and technology at a competitive price, aiming to significantly expand Rivian's market reach. The article details its various trims, pricing, impressive interior space, advanced onboard tech, and excellent on-road and off-road driving performance. The author suggests the R2 is a well-rounded electric SUV without the common compromises found in competitors, positioning it as a strong contender in the EV market.",Cars.com,0.083123,Neutral,2026-06-09
Brand Engagement Network forms AI health joint venture with Intervent International,https://www.investing.com/news/sec-filings/brand-engagement-network-forms-ai-health-joint-venture-with-intervent-international-93CH-4732425,2026-06-09 11:11:07,"Brand Engagement Network (NASDAQ:BNAI) has established Intervent Health AI, Inc., a 50/50 joint venture with Intervent International, LLC. This new entity will focus on developing and commercializing AI-powered health coaching solutions, combining Brand Engagement Network’s conversational AI with Intervent’s clinical methodologies. The venture includes exclusive commercialization agreements for North America through SKYE AI USA, LLC, and non-exclusive reseller arrangements internationally, with both founding companies holding equal ownership stakes.",Investing.com,0.104468,Neutral,2026-06-09
What Happens If Tesla and SpaceX Merge?,https://www.morningstar.com/stocks/what-happens-if-tesla-spacex-merge,2026-06-09 10:04:37,"Morningstar analysts examine the potential for a merger between Tesla and SpaceX, driven by Elon Musk's desire for consolidation and increasing AI collaboration between the companies. While a merger presents strong business cases like streamlined operations and shared AI development, significant hurdles exist, including divergent long-term goals, regulatory concerns, and especially the challenge of agreeing on valuation and equity distribution that satisfies both Tesla and SpaceX shareholders, given SpaceX's high valuation multiples. They expect discussions to intensify after SpaceX's IPO.",Morningstar,0.015153,Neutral,2026-06-09
Wolfspeed’s new chip tech designed to boost EV range and charging efficiency,https://www.stocktitan.net/news/WOLF/wolfspeed-unveils-the-industry-s-lowest-rds-on-silicon-carbide-si-c-6mjxfzk5uo8k.html,2026-06-09 10:03:21,"Wolfspeed has introduced its fifth generation of Silicon Carbide (SiC) MOSFET technology, which significantly improves efficiency for 1200 V and 750 V automotive and industrial applications. This new Gen 5 technology, built on a 200 mm manufacturing platform, reduces specific on-resistance by up to 27%, leading to increased EV mileage range, better charging infrastructure efficiency, and more compact system designs. The technology also enhances durability with an improved junction temperature and provides a low-risk path to market for customers.",Stock Titan,0.312499,Somewhat-Bullish,2026-06-09
"Tesla, Inc. $TSLA Shares Acquired by Focus Partners Advisor Solutions LLC",https://www.marketbeat.com/instant-alerts/filing-tesla-inc-tsla-shares-acquired-by-focus-partners-advisor-solutions-llc-2026-06-09/,2026-06-09 08:38:34,"Focus Partners Advisor Solutions LLC significantly increased its stake in Tesla ($TSLA) by 10.1% in the fourth quarter, bringing its total holdings to $23.22 million. Several other institutional investors also adjusted their positions in the electric vehicle producer. The article also highlights recent positive and neutral news surrounding Tesla, including analyst ratings, price targets, and insider trading activities.",MarketBeat,0.431266,Bullish,2026-06-09
